{
  "schemaVersion": "1.0",
  "workflowId": "top-skill-2-repair-artifact-dogfood",
  "taskId": "judicial-initial-task",
  "role": "judicial",
  "objective": "Validate the explicitly referenced handoff and repair-target artifact for this pass.",
  "allowedActions": [
    "read listed inputs",
    "write judicial handoff"
  ],
  "forbiddenActions": [
    "repair implementation artifacts",
    "certify delivery complete",
    "use hidden prior chat"
  ],
  "inputReferences": [
    "handoffs/executive.handoff.json",
    "invocations/executive.invocation-evidence.json",
    "artifacts/repair-target.json"
  ],
  "contextSlices": [
    "Validate the explicitly referenced initial repair-target artifact and handoffs.",
    "This is the pre-repair judicial pass. If the artifact is invalid, use status done, record the blocking finding, and hand off to repair.",
    "Do not use status blocked merely because the pre-repair artifact is invalid; blocked means the judicial pass itself could not complete.",
    "Do not repair implementation artifacts and do not certify delivery."
  ],
  "outputContract": "handoffs/judicial-initial.handoff.json",
  "requiredChecks": [],
  "stopCondition": "Write one handoff artifact and stop.",
  "mayEditFiles": false,
  "mayValidate": true,
  "mayRepair": false,
  "mayReport": true,
  "mayCertifyDelivery": false
}
