{
  "schemaVersion": "1.0",
  "workflowId": "top-skill-2-repair-loop-dogfood",
  "taskId": "repair-1-task",
  "role": "repair",
  "objective": "Run repair pass repair-1.",
  "allowedActions": [
    "repair scoped validation failures"
  ],
  "forbiddenActions": [
    "validate own repair",
    "certify delivery"
  ],
  "inputReferences": [
    "handoffs/judicial-initial.handoff.json"
  ],
  "contextSlices": [
    "Repair only the failures listed by the prior judicial handoff and runner evidence.",
    "The runner report is produced after pass execution, so do not require it inside this repair pass.",
    "Do not validate your own repair and do not certify delivery.",
    "Return a repair handoff that identifies files changed, commands run, remaining limitations, and handoffTo judicial."
  ],
  "outputContract": "handoffs/repair-1.handoff.json",
  "requiredChecks": [],
  "stopCondition": "Write one handoff artifact and stop.",
  "mayEditFiles": true,
  "mayValidate": false,
  "mayRepair": true,
  "mayReport": false,
  "mayCertifyDelivery": false
}
