{
  "schemaVersion": "1.0",
  "workflowId": "top-skill-2-llm-dogfood",
  "taskId": "judicial-task",
  "role": "judicial",
  "objective": "Independently review the executive handoff and invocation evidence from the bounded LLM API smoke pass.",
  "allowedActions": [
    "read executive handoff",
    "read invocation evidence",
    "write judicial verdict handoff"
  ],
  "forbiddenActions": [
    "repair implementation artifacts",
    "certify delivery complete",
    "ignore missing evidence",
    "use hidden prior chat"
  ],
  "inputReferences": [
    "handoffs/executive.handoff.json",
    "invocations/executive.invocation-evidence.json"
  ],
  "contextSlices": [
    "Independently inspect the supplied executive handoff and invocation evidence.",
    "Treat adapter invocation evidence as execution evidence only; do not certify delivery complete.",
    "Write a judicial handoff with status done when the executive handoff is structurally coherent and no self-certification claim is present.",
    "Do not repair implementation artifacts and do not certify delivery."
  ],
  "outputContract": "handoffs/judicial.handoff.json",
  "requiredChecks": [],
  "stopCondition": "Write one handoff artifact and stop.",
  "mayEditFiles": false,
  "mayValidate": true,
  "mayRepair": false,
  "mayReport": true,
  "mayCertifyDelivery": false
}
